{"model_posterior":{"M1":0,"M2":0,"M3":1},"probabilities":{"C1":0,"C2":1,"C3":1},"decision":"D3","lesson":"P2 was positive, and its unique signature occurs only under M3, so the posterior assigns all probability to M3. Therefore C2 and C3 are predicted to pass, while C1 is predicted to fail. M3's intervention is justified because its posterior is at least 0.80.","next_action":"N1"}