{"model_posterior":{"M1":1,"M2":0,"M3":0},"probabilities":{"C1":1,"C2":1,"C3":0},"decision":"D1","lesson":"P2 was positive, and its signature occurs only under M1, so the posterior supports M1 exclusively. Therefore C1 and C2 are predicted to pass, while C3 is predicted to fail.","next_action":"N1"}